{
  "slug": "_template",
  "title": "",
  "client_name": "Confidential",
  "industry": "",
  "context": "",
  "challenge": "",
  "approach": "",
  "outcome": "",
  "learnings": "",
  "services_used": [],
  "engagement_type": "advisory",
  "is_anonymised": true,
  "featured_image": "",
  "published": false,
  "publish_date": "",
  "description": ""
}
